<contextCollection xmlns="http://preview.pdok.nl/1.0"
                   xmlns:xsi="http://www.w3.org/2001/XMLSchema-instance"
                   xsi:schemaLocation="http://preview.pdok.nl/1.0 config.xsd ">
    <contextFolder>
        <title>Natuurmeting Op Kaart (NOK)</title>
        <context>
            <title>2011</title>
            <tmsLayer>
                <title>NOK 2011 [tms]</title>
                <url>{baseUrl}tms/</url>
                <isBaseLayer>true</isBaseLayer>
                <opacity>0.7</opacity>
                <isTransparent>true</isTransparent>
                <isVisible>false</isVisible>
                <minResolution>0.21</minResolution>
                <layername>nok2011</layername>
                <type>png</type>
                <bgColor>0xffffff</bgColor>
                <isSingleTile>false</isSingleTile>
                <isAlpha>true</isAlpha>
            </tmsLayer>
            <wmtsLayer>
                <title>NOK 2011 [wmts]</title>
                <url>{baseUrl}tiles/service/wmts/nok2011?</url>
                <isBaseLayer>false</isBaseLayer>
                <opacity>0.7</opacity>
                <isTransparent>true</isTransparent>
                <isVisible>false</isVisible>
                <minResolution>0.21</minResolution>
                <layer>nok2011</layer>
                <style>_null</style>
                <matrixSet>EPSG:28992</matrixSet>
                <matrixIds>
                    EPSG:28992:0,EPSG:28992:1,EPSG:28992:2,EPSG:28992:3,EPSG:28992:4,EPSG:28992:5,EPSG:28992:6,EPSG:28992:7,EPSG:28992:8,EPSG:28992:9,EPSG:28992:10,EPSG:28992:11,EPSG:28992:12,EPSG:28992:13,EPSG:28992:14
                </matrixIds>
                <format>image/png</format>
            </wmtsLayer>
            <wmsLayer>
                <title>Begrenzing 2011 [wms]</title>
                <url>{baseUrl}nok2011/wms?</url>
                <isBaseLayer>false</isBaseLayer>
                <opacity>0.7</opacity>
                <isTransparent>true</isTransparent>
                <isVisible>false</isVisible>
                <layers>begrenzing</layers>
                <format>image/png</format>
                <featureInfoFormat>application/vnd.ogc.gml</featureInfoFormat>
                <isAlpha>true</isAlpha>
                <isSingleTile>true</isSingleTile>
            </wmsLayer>
            <wmsLayer>
                <title>EHS 2011 [wms]</title>
                <url>{baseUrl}nok2011/wms?</url>
                <isBaseLayer>false</isBaseLayer>
                <opacity>0.7</opacity>
                <isTransparent>true</isTransparent>
                <isVisible>false</isVisible>
                <layers>planologischeehs</layers>
                <format>image/png</format>
                <featureInfoFormat>application/vnd.ogc.gml</featureInfoFormat>
                <isAlpha>true</isAlpha>
                <isSingleTile>true</isSingleTile>
            </wmsLayer>
            <wmsLayer>
                <title>Verwerving inrichting 2011 [wms]</title>
                <url>{baseUrl}nok2011/wms?</url>
                <isBaseLayer>false</isBaseLayer>
                <opacity>0.7</opacity>
                <isTransparent>true</isTransparent>
                <isVisible>false</isVisible>
                <layers>verwervinginrichting</layers>
                <format>image/png</format>
                <featureInfoFormat>application/vnd.ogc.gml</featureInfoFormat>
                <isAlpha>true</isAlpha>
                <isSingleTile>true</isSingleTile>
            </wmsLayer>
        </context>
        <context>
            <title>2010</title>
            <wmsLayer>
                <title>EHS 2010 [wms]</title>
                <url>{baseUrl}nok2010/wms?</url>
                <isBaseLayer>false</isBaseLayer>
                <opacity>0.7</opacity>
                <isTransparent>true</isTransparent>
                <isVisible>false</isVisible>
                <layers>ehs</layers>
                <format>image/png</format>
                <featureInfoFormat>application/vnd.ogc.gml</featureInfoFormat>
                <isAlpha>true</isAlpha>
                <isSingleTile>true</isSingleTile>
            </wmsLayer>
            <wmsLayer>
                <title>RodS 2010 [wms]</title>
                <url>{baseUrl}nok2010/wms?</url>
                <isBaseLayer>false</isBaseLayer>
                <opacity>0.7</opacity>
                <isTransparent>true</isTransparent>
                <isVisible>false</isVisible>
                <layers>rods</layers>
                <format>image/png</format>
                <featureInfoFormat>application/vnd.ogc.gml</featureInfoFormat>
                <isAlpha>true</isAlpha>
                <isSingleTile>true</isSingleTile>
            </wmsLayer>
            <wmsLayer>
                <title>BBL-bezit buiten EHS en RodS 2010 [wms]</title>
                <url>{baseUrl}nok2010/wms?</url>
                <isBaseLayer>false</isBaseLayer>
                <opacity>0.7</opacity>
                <isTransparent>true</isTransparent>
                <isVisible>false</isVisible>
                <layers>bblbuitenbegrenzing</layers>
                <format>image/png</format>
                <featureInfoFormat>application/vnd.ogc.gml</featureInfoFormat>
                <isAlpha>true</isAlpha>
                <isSingleTile>true</isSingleTile>
            </wmsLayer>
        </context>
        <context>
            <title>2007</title>
            <wmsLayer>
                <title>EHS 2007 [wms]</title>
                <url>{baseUrl}nok2007/wms?</url>
                <isBaseLayer>false</isBaseLayer>
                <opacity>0.7</opacity>
                <isTransparent>true</isTransparent>
                <isVisible>false</isVisible>
                <layers>ehs</layers>
                <format>image/png</format>
                <featureInfoFormat>application/vnd.ogc.gml</featureInfoFormat>
                <isAlpha>true</isAlpha>
                <isSingleTile>true</isSingleTile>
            </wmsLayer>
            <wmsLayer>
                <title>RodS 2007 [wms]</title>
                <url>{baseUrl}nok2007/wms?</url>
                <isBaseLayer>false</isBaseLayer>
                <opacity>0.7</opacity>
                <isTransparent>true</isTransparent>
                <isVisible>false</isVisible>
                <layers>rods</layers>
                <format>image/png</format>
                <featureInfoFormat>application/vnd.ogc.gml</featureInfoFormat>
                <isAlpha>true</isAlpha>
                <isSingleTile>true</isSingleTile>
            </wmsLayer>
            <wmsLayer>
                <title>BBL-bezit buiten EHS en RodS 2007 [wms]</title>
                <url>{baseUrl}nok2007/wms?</url>
                <isBaseLayer>false</isBaseLayer>
                <opacity>0.7</opacity>
                <isTransparent>true</isTransparent>
                <isVisible>false</isVisible>
                <layers>bblbuitenbegrenzing</layers>
                <format>image/png</format>
                <featureInfoFormat>application/vnd.ogc.gml</featureInfoFormat>
                <isAlpha>true</isAlpha>
                <isSingleTile>true</isSingleTile>
            </wmsLayer>
        </context>
    </contextFolder>
</contextCollection>