<contextCollection xmlns="http://preview.pdok.nl/1.0"
	xmlns:xsi="http://www.w3.org/2001/XMLSchema-instance"
	xsi:schemaLocation="http://preview.pdok.nl/1.0 config.xsd ">
	<context>
		<title>Top250NL Raster</title>
		<wmsLayer>
			<title>Top250NL Raster [wms]</title>
			<url>{baseUrl}top250raster/wms?</url>
			<isBaseLayer>true</isBaseLayer>
			<opacity>0.7</opacity>
			<isTransparent>true</isTransparent>
			<isVisible>false</isVisible>
			<minResolution>53.76</minResolution>
			<maxResolution>107.52</maxResolution>
			<layers>top250raster</layers>
			<format>image/png</format>
			<featureInfoFormat>application/vnd.ogc.gml</featureInfoFormat>
			<isAlpha>true</isAlpha>
			<isSingleTile>true</isSingleTile>
		</wmsLayer>
	</context>
</contextCollection>