<contextCollection xmlns="http://preview.pdok.nl/1.0"
                   xmlns:xsi="http://www.w3.org/2001/XMLSchema-instance"
                   xsi:schemaLocation="http://preview.pdok.nl/1.0 config.xsd ">
    <context>
        <title>Noordzee Maritieme Grenzen</title>
        <wmsLayer>
            <title>Nederlandse basislijn [wms]</title>
            <url>{baseUrl}maritiemegrenzen/wms?</url>
            <isBaseLayer>false</isBaseLayer>
            <opacity>0.7</opacity>
            <isTransparent>true</isTransparent>
            <isVisible>false</isVisible>
            <maxResolution>53.76</maxResolution>
            <layers>nederlandsebasislijn</layers>
            <format>image/png</format>
            <featureInfoFormat>application/vnd.ogc.gml</featureInfoFormat>
            <isAlpha>true</isAlpha>
            <isSingleTile>true</isSingleTile>
        </wmsLayer>
        <wmsLayer>
            <title>Nautische 1 mijl grens [wms]</title>
            <url>{baseUrl}maritiemegrenzen/wms?</url>
            <isBaseLayer>false</isBaseLayer>
            <opacity>0.7</opacity>
            <isTransparent>true</isTransparent>
            <isVisible>false</isVisible>
            <layers>nautische01mijlgrens</layers>
            <format>image/png</format>
            <featureInfoFormat>application/vnd.ogc.gml</featureInfoFormat>
            <isAlpha>true</isAlpha>
            <isSingleTile>true</isSingleTile>
        </wmsLayer>
        <wmsLayer>
            <title>Nautische 3 mijl grens [wms]</title>
            <url>{baseUrl}maritiemegrenzen/wms?</url>
            <isBaseLayer>false</isBaseLayer>
            <opacity>0.7</opacity>
            <isTransparent>true</isTransparent>
            <isVisible>false</isVisible>
            <layers>nautische03mijlgrens</layers>
            <format>image/png</format>
            <featureInfoFormat>application/vnd.ogc.gml</featureInfoFormat>
            <isAlpha>true</isAlpha>
            <isSingleTile>true</isSingleTile>
        </wmsLayer>
        <wmsLayer>
            <title>Nautische 6 mijl grens [wms]</title>
            <url>{baseUrl}maritiemegrenzen/wms?</url>
            <isBaseLayer>false</isBaseLayer>
            <opacity>0.7</opacity>
            <isTransparent>true</isTransparent>
            <isVisible>false</isVisible>
            <layers>nautische06mijlgrens</layers>
            <format>image/png</format>
            <featureInfoFormat>application/vnd.ogc.gml</featureInfoFormat>
            <isAlpha>true</isAlpha>
            <isSingleTile>true</isSingleTile>
        </wmsLayer>
        <wmsLayer>
            <title>Nautische 12 mijl grens [wms]</title>
            <url>{baseUrl}maritiemegrenzen/wms?</url>
            <isBaseLayer>false</isBaseLayer>
            <opacity>0.7</opacity>
            <isTransparent>true</isTransparent>
            <isVisible>false</isVisible>
            <layers>nautische12mijlgrens</layers>
            <format>image/png</format>
            <featureInfoFormat>application/vnd.ogc.gml</featureInfoFormat>
            <isAlpha>true</isAlpha>
            <isSingleTile>true</isSingleTile>
        </wmsLayer>
        <wmsLayer>
            <title>Nautische 24 mijl grens [wms]</title>
            <url>{baseUrl}maritiemegrenzen/wms?</url>
            <isBaseLayer>false</isBaseLayer>
            <opacity>0.7</opacity>
            <isTransparent>true</isTransparent>
            <isVisible>false</isVisible>
            <layers>nautische24mijlgrens</layers>
            <format>image/png</format>
            <featureInfoFormat>application/vnd.ogc.gml</featureInfoFormat>
            <isAlpha>true</isAlpha>
            <isSingleTile>true</isSingleTile>
        </wmsLayer>
    </context>
</contextCollection>