<contextCollection xmlns="http://preview.pdok.nl/1.0"
	xmlns:xsi="http://www.w3.org/2001/XMLSchema-instance"
	xsi:schemaLocation="http://preview.pdok.nl/1.0 ../config.xsd">
	<context>
			<title>Natura 2000</title>
			<wmsLayer>
				<title>Natura 2000 [wms]</title>
				<url>{baseUrl}natura2000/wms?</url>
				<isBaseLayer>false</isBaseLayer>
				<opacity>0.7</opacity>
				<isTransparent>true</isTransparent>
				<isVisible>false</isVisible>
				<layers>natura2000</layers>
				<format>image/png</format>
				<featureInfoFormat>application/vnd.ogc.gml</featureInfoFormat>
				<isAlpha>true</isAlpha>
				<isSingleTile>true</isSingleTile>
			</wmsLayer>	
	</context>
</contextCollection>