<?xml version="1.0" encoding="UTF-8"?>
<contextCollection xmlns="http://preview.pdok.nl/1.0"
                   xmlns:xsi="http://www.w3.org/2001/XMLSchema-instance"
                   xsi:schemaLocation="http://preview.pdok.nl/1.0 config.xsd ">

    <title>Protocol PDOK configuratie - Deze configuratie bevat alle services geordend naar type service</title>
    <baseUrl>http://test.geodata.nationaalgeoregister.nl/</baseUrl>
    <projection>EPSG:28992</projection>
    <units>m</units>
    <resolutions>3440.640,1720.320, 860.160, 430.080, 215.040, 107.520, 53.760, 26.880, 13.440, 6.720, 3.360, 1.680,0.840, 0.420, 0.210, 0.105, 0.0525</resolutions>
    <maxExtent>-285401.920,22598.080,595401.920,903401.920</maxExtent>
    <center>155000,463000</center>
    <xyPrecision>3</xyPrecision>
    <zoom>2</zoom>

    <contextFolder>
        <isExpanded>true</isExpanded>
        <title>TMS</title>
        <context>
            <url>tms/brtachtergrondkaart</url>
        </context>
        <context>
            <url>tms/aan</url>
        </context>
        <context>
            <url>tms/natura2000</url>
        </context>
        <context>
            <url>tms/nok2011</url>
        </context>
        <context>
            <url>tms/top10nl</url>
        </context>
        <context>
            <url>tms/top50vector</url>
        </context>
        <context>
            <url>tms/top50raster</url>
        </context>
        <context>
            <url>tms/top250raster</url>
        </context>
    </contextFolder>
    <contextFolder>
        <isExpanded>true</isExpanded>
        <title>WMTS</title>
        <context>
            <url>wmts/brtachtergrondkaart</url>
        </context>
        <context>
            <url>wmts/aan</url>
        </context>
        <context>
            <url>wmts/kadastralekaart</url>
        </context>
        <context>
            <url>wmts/natura2000</url>
        </context>
        <context>
            <url>wmts/nok2011</url>
        </context>
        <context>
            <url>wmts/top10nl</url>
        </context>
        <context>
            <url>wmts/top50vector</url>
        </context>
        <context>
            <url>wmts/top50raster</url>
        </context>
        <context>
            <url>wmts/top250raster</url>
        </context>
    </contextFolder>
    <contextFolder>
        <isExpanded>true</isExpanded>
        <title>WMS</title>
        <context>
            <url>wms/aan</url>
        </context>
        <context>
            <url>wms/ahn</url>
        </context>
        <context>
            <url>wms/asbestscholenkaart</url>
        </context>
        <context>
            <url>wms/beschermdenatuurmonumenten</url>
        </context>
        <context>
            <url>wms/bestuurlijkegrenzen</url>
        </context>
        <context>
            <url>wms/bevolkingskernen2008</url>
        </context>
        <context>
            <url>wms/bodemgebruik2008</url>
        </context>
        <context>
            <url>wms/cbsvierkanten</url>
        </context>
        <context>
            <url>wms/cultgis</url>
        </context>
        <context>
            <url>wms/dtb</url>
        </context>
        <context>
            <url>wms/fietsknooppuntennetwerk</url>
        </context>
        <context>
            <url>wms/inspireadressen</url>
        </context>
        <context>
            <url>wms/kadastralekaart</url>
        </context>
        <context>
            <url>wms/lawroutes</url>
        </context>
        <context>
            <url>wms/lfroutes</url>
        </context>
        <context>
            <url>wms/streekpaden</url>
        </context>
        <context>
            <url>wms/nationaleparken</url>
        </context>
        <context>
            <url>wms/nhi</url>
        </context>
        <context>
            <url>wms/natura2000</url>
        </context>
        <context>
            <url>wms/nwb</url>
        </context>
        <context>
            <url>wms/nok</url>
        </context>
        <context>
            <url>wms/noordzeekabelsenleidingen</url>
        </context>
        <context>
            <url>wms/maritiemegrenzen</url>
        </context>
        <context>
            <url>wms/noordzeevaarwegmarkeringenrd</url>
        </context>
        <context>
            <url>wms/noordzeewingebieden</url>
        </context>
        <context>
            <url>wms/rdinfo</url>
        </context>
        <context>
            <url>wms/top10nl</url>
        </context>
        <context>
            <url>wms/top50vector</url>
        </context>
        <context>
            <url>wms/top50raster</url>
        </context>
        <context>
            <url>wms/top250raster</url>
        </context>
        <context>
            <url>wms/vin</url>
        </context>
        <context>
            <url>wms/weggegevens</url>
        </context>
        <context>
            <url>wms/wetlands</url>
        </context>
        <context>
            <url>wms/wijkenenbuurten</url>
        </context>
    </contextFolder>
    <contextFolder>
        <isExpanded>true</isExpanded>
        <title>WFS</title>
        <context>
            <url>wfs/nwb</url>
        </context>
    </contextFolder>
</contextCollection>
