<contextCollection xmlns="http://preview.pdok.nl/1.0"
                   xmlns:xsi="http://www.w3.org/2001/XMLSchema-instance"
                   xsi:schemaLocation="http://preview.pdok.nl/1.0 ../config.xsd">
    <context>
        <title>Top250NL Raster</title>
        <tmsLayer>
            <title>Top250NL Raster [tms]</title>
            <url>{baseUrl}tms/</url>
            <isBaseLayer>false</isBaseLayer>
            <opacity>0.7</opacity>
            <isTransparent>true</isTransparent>
            <isVisible>false</isVisible>
            <minResolution>53.76</minResolution>
            <maxResolution>107.52</maxResolution>
            <layername>top250raster</layername>
            <type>png</type>
            <bgColor>0xffffff</bgColor>
            <isSingleTile>false</isSingleTile>
            <isAlpha>true</isAlpha>
        </tmsLayer>
        <wmtsLayer>
            <title>Top250NL Raster [wmts]</title>
            <url>{baseUrl}tiles/service/wmts/top50raster?</url>
            <isBaseLayer>false</isBaseLayer>
            <opacity>0.7</opacity>
            <isTransparent>true</isTransparent>
            <isVisible>false</isVisible>
            <minResolution>53.76</minResolution>
            <maxResolution>107.52</maxResolution>
            <layer>top250raster</layer>
            <style>_null</style>
            <matrixSet>EPSG:28992</matrixSet>
            <matrixIds>
                EPSG:28992:0,EPSG:28992:1,EPSG:28992:2,EPSG:28992:3,EPSG:28992:4,EPSG:28992:5,EPSG:28992:6,EPSG:28992:7,EPSG:28992:8,EPSG:28992:9,EPSG:28992:10,EPSG:28992:11,EPSG:28992:12,EPSG:28992:13,EPSG:28992:14
            </matrixIds>
            <format>image/png</format>
        </wmtsLayer>
        <wmsLayer>
            <title>Top250NL Raster [wms]</title>
            <url>{baseUrl}top250raster/wms?</url>
            <isBaseLayer>false</isBaseLayer>
            <opacity>0.7</opacity>
            <isTransparent>true</isTransparent>
            <isVisible>false</isVisible>
            <minResolution>53.76</minResolution>
            <maxResolution>107.52</maxResolution>
            <layers>top250raster</layers>
            <format>image/png</format>
            <featureInfoFormat>application/vnd.ogc.gml</featureInfoFormat>
            <isAlpha>true</isAlpha>
            <isSingleTile>true</isSingleTile>
        </wmsLayer>
    </context>
</contextCollection>