<contextCollection xmlns="http://preview.pdok.nl/1.0"
                   xmlns:xsi="http://www.w3.org/2001/XMLSchema-instance"
                   xsi:schemaLocation="http://preview.pdok.nl/1.0 ../config.xsd">
    <context>
        <title>Top10NL</title>
        <tmsLayer>
            <title>Top10NL [tms]</title>
            <url>{baseUrl}tms/</url>
            <isBaseLayer>false</isBaseLayer>
            <opacity>0.7</opacity>
            <isTransparent>true</isTransparent>
            <isVisible>false</isVisible>
            <minResolution>0.21</minResolution>
            <maxResolution>13.44</maxResolution>
            <layername>top10nl</layername>
            <type>png</type>
            <bgColor>0xffffff</bgColor>
            <isSingleTile>false</isSingleTile>
            <isAlpha>true</isAlpha>
        </tmsLayer>
        <wmtsLayer>
            <title>Top10NL [wmts]</title>
            <url>{baseUrl}tiles/service/wmts/top10nl?</url>
            <isBaseLayer>false</isBaseLayer>
            <opacity>0.7</opacity>
            <isTransparent>true</isTransparent>
            <isVisible>false</isVisible>
            <minResolution>0.21</minResolution>
            <maxResolution>13.44</maxResolution>
            <layer>top10nl</layer>
            <style>_null</style>
            <matrixSet>EPSG:28992</matrixSet>
            <matrixIds>
                EPSG:28992:0,EPSG:28992:1,EPSG:28992:2,EPSG:28992:3,EPSG:28992:4,EPSG:28992:5,EPSG:28992:6,EPSG:28992:7,EPSG:28992:8,EPSG:28992:9,EPSG:28992:10,EPSG:28992:11,EPSG:28992:12,EPSG:28992:13,EPSG:28992:14
            </matrixIds>
            <format>image/png</format>
        </wmtsLayer>
        <wmsLayer>
            <title>Geografische namen [wms]</title>
            <url>{baseUrl}top10nl/wms?</url>
            <isBaseLayer>false</isBaseLayer>
            <opacity>0.7</opacity>
            <isTransparent>true</isTransparent>
            <isVisible>false</isVisible>
            <maxResolution>6.72</maxResolution>
            <layers>geo_labels</layers>
            <format>image/png</format>
            <featureInfoFormat>application/vnd.ogc.gml</featureInfoFormat>
            <isAlpha>true</isAlpha>
            <isSingleTile>true</isSingleTile>
        </wmsLayer>
        <wmsLayer>
            <title>Functionele gebieden [wms]</title>
            <url>{baseUrl}top10nl/wms?</url>
            <isBaseLayer>false</isBaseLayer>
            <opacity>0.7</opacity>
            <isTransparent>true</isTransparent>
            <isVisible>false</isVisible>
            <maxResolution>6.72</maxResolution>
            <layers>functioneelgebied_labels</layers>
            <format>image/png</format>
            <featureInfoFormat>application/vnd.ogc.gml</featureInfoFormat>
            <isAlpha>true</isAlpha>
            <isSingleTile>true</isSingleTile>
        </wmsLayer>
        <wmsLayer>
            <title>Inrichtingselement - punten [wms]</title>
            <url>{baseUrl}top10nl/wms?</url>
            <isBaseLayer>false</isBaseLayer>
            <opacity>0.7</opacity>
            <isTransparent>true</isTransparent>
            <isVisible>false</isVisible>
            <maxResolution>6.72</maxResolution>
            <layers>inrichtingselement_punten</layers>
            <format>image/png</format>
            <featureInfoFormat>application/vnd.ogc.gml</featureInfoFormat>
            <isAlpha>true</isAlpha>
            <isSingleTile>true</isSingleTile>
        </wmsLayer>
        <wmsLayer>
            <title>Spoorbaandeel - lijnen [wms]</title>
            <url>{baseUrl}top10nl/wms?</url>
            <isBaseLayer>false</isBaseLayer>
            <opacity>0.7</opacity>
            <isTransparent>true</isTransparent>
            <isVisible>false</isVisible>
            <maxResolution>6.72</maxResolution>
            <layers>spoorbaandeel_lijnen</layers>
            <format>image/png</format>
            <featureInfoFormat>application/vnd.ogc.gml</featureInfoFormat>
            <isAlpha>true</isAlpha>
            <isSingleTile>true</isSingleTile>
        </wmsLayer>
        <wmsLayer>
            <title>Inrichtingselement - lijnen [wms]</title>
            <url>{baseUrl}top10nl/wms?</url>
            <isBaseLayer>false</isBaseLayer>
            <opacity>0.7</opacity>
            <isTransparent>true</isTransparent>
            <isVisible>false</isVisible>
            <maxResolution>6.72</maxResolution>
            <layers>inrichtingselement_lijnen</layers>
            <format>image/png</format>
            <featureInfoFormat>application/vnd.ogc.gml</featureInfoFormat>
            <isAlpha>true</isAlpha>
            <isSingleTile>true</isSingleTile>
        </wmsLayer>
        <wmsLayer>
            <title>Waterdeel - lijnen [wms]</title>
            <url>{baseUrl}top10nl/wms?</url>
            <isBaseLayer>false</isBaseLayer>
            <opacity>0.7</opacity>
            <isTransparent>true</isTransparent>
            <isVisible>false</isVisible>
            <maxResolution>6.72</maxResolution>
            <layers>waterdeel_lijnen</layers>
            <format>image/png</format>
            <featureInfoFormat>application/vnd.ogc.gml</featureInfoFormat>
            <isAlpha>true</isAlpha>
            <isSingleTile>true</isSingleTile>
        </wmsLayer>
        <wmsLayer>
            <title>Gebouwen [wms]</title>
            <url>{baseUrl}top10nl/wms?</url>
            <isBaseLayer>false</isBaseLayer>
            <opacity>0.7</opacity>
            <isTransparent>true</isTransparent>
            <isVisible>false</isVisible>
            <maxResolution>6.72</maxResolution>
            <layers>gebouwen</layers>
            <format>image/png</format>
            <featureInfoFormat>application/vnd.ogc.gml</featureInfoFormat>
            <isAlpha>true</isAlpha>
            <isSingleTile>true</isSingleTile>
        </wmsLayer>
        <wmsLayer>
            <title>Waterdeel - vlakken [wms]</title>
            <url>{baseUrl}top10nl/wms?</url>
            <isBaseLayer>false</isBaseLayer>
            <opacity>0.7</opacity>
            <isTransparent>true</isTransparent>
            <isVisible>false</isVisible>
            <maxResolution>6.72</maxResolution>
            <layers>waterdeel_vlakken</layers>
            <format>image/png</format>
            <featureInfoFormat>application/vnd.ogc.gml</featureInfoFormat>
            <isAlpha>true</isAlpha>
            <isSingleTile>true</isSingleTile>
        </wmsLayer>
        <wmsLayer>
            <title>Wegdeelvlakken [wms]</title>
            <url>{baseUrl}top10nl/wms?</url>
            <isBaseLayer>false</isBaseLayer>
            <opacity>0.7</opacity>
            <isTransparent>true</isTransparent>
            <isVisible>false</isVisible>
            <maxResolution>6.72</maxResolution>
            <layers>wegdeelvlakken</layers>
            <format>image/png</format>
            <featureInfoFormat>application/vnd.ogc.gml</featureInfoFormat>
            <isAlpha>true</isAlpha>
            <isSingleTile>true</isSingleTile>
        </wmsLayer>
        <wmsLayer>
            <title>Terreinen [wms]</title>
            <url>{baseUrl}top10nl/wms?</url>
            <isBaseLayer>false</isBaseLayer>
            <opacity>0.7</opacity>
            <isTransparent>true</isTransparent>
            <isVisible>false</isVisible>
            <maxResolution>6.72</maxResolution>
            <layers>terreinen</layers>
            <format>image/png</format>
            <featureInfoFormat>application/vnd.ogc.gml</featureInfoFormat>
            <isAlpha>true</isAlpha>
            <isSingleTile>true</isSingleTile>
        </wmsLayer>
        <atomLayer>
            <title>Top10NL [atom]</title>
            <url>{baseUrl}top10nl/atom/top10nl.xml</url>
            <isBaseLayer>false</isBaseLayer>
            <isVisible>false</isVisible>
        </atomLayer>
    </context>
</contextCollection>