<contextCollection xmlns="http://preview.pdok.nl/1.0"
	xmlns:xsi="http://www.w3.org/2001/XMLSchema-instance"
	xsi:schemaLocation="http://preview.pdok.nl/1.0 config.xsd ">
	<context>
		<title>Top50NL Raster</title>
		<tmsLayer>
			<title>Top50NL Raster [tms]</title>
			<url>{baseUrl}tms/</url>
			<isBaseLayer>true</isBaseLayer>
			<opacity>0.7</opacity>
			<isTransparent>true</isTransparent>
			<isVisible>false</isVisible>
			<minResolution>13.44</minResolution>
			<maxResolution>26.88</maxResolution>
			<layername>top50raster</layername>
			<type>png</type>
			<bgColor>0xffffff</bgColor>
			<isSingleTile>false</isSingleTile>
			<isAlpha>true</isAlpha>
		</tmsLayer>
	</context>
</contextCollection>