<contextCollection xmlns="http://preview.pdok.nl/1.0"
	xmlns:xsi="http://www.w3.org/2001/XMLSchema-instance"
	xsi:schemaLocation="http://preview.pdok.nl/1.0 config.xsd ">
	<context>
		<title>Noordzee Kabels en Leidingen</title>
		<wmsLayer>
			<title>Kabels [wms]</title>
			<url>{baseUrl}noordzeekabelsenleidingen/wms?</url>
			<isBaseLayer>false</isBaseLayer>
			<opacity>0.7</opacity>
			<isTransparent>true</isTransparent>
			<isVisible>false</isVisible>
			<maxResolution>53.76</maxResolution>
			<layers>kabels</layers>
			<format>image/png</format>
			<featureInfoFormat>application/vnd.ogc.gml</featureInfoFormat>
			<isAlpha>true</isAlpha>
			<isSingleTile>true</isSingleTile>
		</wmsLayer>
		<wmsLayer>
			<title>Leidingen [wms]</title>
			<url>{baseUrl}noordzeekabelsenleidingen/wms?</url>
			<isBaseLayer>false</isBaseLayer>
			<opacity>0.7</opacity>
			<isTransparent>true</isTransparent>
			<isVisible>false</isVisible>
			<layers>leidingen</layers>
			<format>image/png</format>
			<featureInfoFormat>application/vnd.ogc.gml</featureInfoFormat>
			<isAlpha>true</isAlpha>
			<isSingleTile>true</isSingleTile>
		</wmsLayer>
	</context>
</contextCollection>